<?xml version="1.0" encoding="UTF-8"?>
<Scores xmlns="http://www.findly.com"
xmlns:xsi="http://www.w3.org/2001/XMLSchema-instance"
xsi:schemaLocation="http://www.findly.com Kelly.xsd">
  <NumScores>1</NumScores>
  <Score>
    <UserInfo>
      <eTicketID>4133575171848687528</eTicketID>
      <ScoreID>15533376</ScoreID>
      <ExternalID>0</ExternalID>
      <FirstName>Megan</FirstName>
      <LastName>Smith</LastName>
      <ID>2137</ID>
      <AdditionalData>
        <UserData />
      </AdditionalData>
    </UserInfo>
    <TestInfo>
      <TestID>EN_TYPK1</TestID>
      <TestName>Typing Test (KS)</TestName>
      <Date>7/5/2012</Date>
      <DateAsNumber>20120705</DateAsNumber>
      <TimeStart>20:28:40</TimeStart>
      <TimeElapsed>300</TimeElapsed>
    </TestInfo>
    <ScoreInfo>
      <ScoreType>STANDARD</ScoreType>
      <ReportURL>https://webtest.skillcheck.com/onlinetesting/servlet/com.skillcheck.session_management.SK_Servlet?ID=KSUS-1234&amp;MODE=REPORTRETRIEVAL,scoreKey.15533376,html</ReportURL>
      <NumMetrics>6</NumMetrics>
      <Metric>
        <MetricName>Rating</MetricName>
        <MetricDesc>Rating</MetricDesc>
        <MetricValue>
          <Rating>Basic</Rating>
        </MetricValue>
      </Metric>
      <Metric>
        <MetricName>GrossWPM</MetricName>
        <MetricDesc>Gross speed (words per minute)</MetricDesc>
        <MetricValue>50</MetricValue>
      </Metric>
      <Metric>
        <MetricName>Errors</MetricName>
        <MetricDesc>Total number of errors</MetricDesc>
        <MetricValue>30</MetricValue>
      </Metric>
      <Metric>
        <MetricName>AdjErrors</MetricName>
        <MetricDesc>Errors adjusted for time</MetricDesc>
        <MetricValue>18</MetricValue>
      </Metric>
      <Metric>
        <MetricName>NetWPM</MetricName>
        <MetricDesc>Net speed (words per minute)</MetricDesc>
        <MetricValue>32</MetricValue>
      </Metric>
      <Metric>
        <MetricName>AccuracyRate</MetricName>
        <MetricDesc>Accuracy percentage rate over time</MetricDesc>
        <MetricValue>-3499</MetricValue>
      </Metric>
    </ScoreInfo>
  </Score>
</Scores>


